{
  "datasetId": "front_manager_guide_dataset",
  "version": "1.0.0",
  "language": "ko-KR",
  "status": "implementation-ready-v1",
  "designContract": {
    "guideDoesNotJudge": true,
    "factProducerOwnsGameLogic": true,
    "deterministicVariationSelection": {
      "strategy": "WeightedHash",
      "hashAlgorithm": "FNV1A64_UTF8",
      "seedTemplate": "{worldSeed}|{eventId}|{cueId}",
      "fallbackSeedTemplate": "{saveId}|{sequenceNo}|{cueId}"
    },
    "defaultSuppressionContexts": [
      "PlayerMinigameInput",
      "BlockingCinematic"
    ],
    "priorityOrder": [
      "Critical",
      "High",
      "Normal",
      "Low",
      "Flavor"
    ],
    "homeFullDialogueMaxPerEntry": 1,
    "nonCriticalDuringMatch": "queue-until-safe-point",
    "runtimeContextKeys": [
      "worldSeed",
      "saveId",
      "eventId",
      "sequenceNo",
      "dayId",
      "weekId",
      "seasonId",
      "matchId",
      "teamSeasonKey",
      "rosterRevision",
      "lineupRevision",
      "loadoutRevision",
      "slotRevision",
      "catalogRevision",
      "worldAwardRevision",
      "trainingRevision",
      "duplicateRevision",
      "careerPlayerId",
      "playerInstanceId",
      "awardRecordId",
      "playerPersonId",
      "pityCycleId",
      "filterKey",
      "scoutRollId",
      "cardId",
      "acquisitionId",
      "saleAttemptId",
      "teamColorId",
      "groupId",
      "activationId",
      "counterId",
      "offerId",
      "offerBoardId",
      "tradeInquiryId",
      "transactionId",
      "contractId",
      "newsId"
    ]
  },
  "projectRules": {
    "activeRosterSize": 25,
    "hitters": 14,
    "pitchers": 11,
    "startingHitters": 9,
    "benchHitters": 5,
    "startingPitchers": 5,
    "bullpenPitchers": 4,
    "setupPitchers": 1,
    "closerPitchers": 1,
    "maxForeignPlayers": 3,
    "duplicatePlayerPersonAllowedInActiveRoster": false,
    "offPositionHitterAllowed": true,
    "offPositionHitterCosts": [
      "ConditionPenalty",
      "FieldingErrorRisk"
    ],
    "dhOffPositionPenalty": false,
    "pitcherRoleMismatchAllowed": true,
    "pitcherRoleMismatchCosts": [
      "ConditionPenalty"
    ],
    "tacticSlots": 2,
    "maxDisruptionTactics": 1,
    "tacticConsumedOnMatchConfirmation": true,
    "scoutPityThreshold": 100,
    "focusScoutMinimumCost": 7,
    "careerManagerOwnsLineupAndTactics": true,
    "careerAllStarHonorExpires": "CurrentSeasonEnd",
    "careerGoldenGloveHonorExpires": "NextSeasonEnd",
    "careerMvpHonorExpires": "NextSeasonEnd"
  },
  "enums": {
    "modeScope": [
      "Common",
      "Owner",
      "Career"
    ],
    "priority": [
      "Critical",
      "High",
      "Normal",
      "Low",
      "Flavor"
    ],
    "presentationType": [
      "FullDialogue",
      "Briefing",
      "ContextBubble",
      "Toast",
      "NotificationCard",
      "ModalCelebration"
    ],
    "expressionKey": [
      "Neutral",
      "Welcome",
      "Analysis",
      "Concerned",
      "Warning",
      "Celebrate",
      "Surprised",
      "Calm"
    ],
    "tone": [
      "Calm",
      "Friendly",
      "Analysis",
      "Concerned",
      "Warning",
      "Celebrate",
      "Welcome",
      "Surprised"
    ],
    "cooldownScope": [
      "Event",
      "Revision",
      "Day",
      "Week",
      "Season",
      "Save"
    ]
  },
  "character": {
    "characterId": "FRONT_MANAGER_DEFAULT_01",
    "displayNameKey": "guide.character.front_manager_default_01",
    "defaultExpression": "Neutral",
    "expressions": {
      "Neutral": "FM_NEUTRAL",
      "Welcome": "FM_WELCOME",
      "Analysis": "FM_ANALYSIS",
      "Concerned": "FM_CONCERNED",
      "Warning": "FM_WARNING",
      "Celebrate": "FM_CELEBRATE",
      "Surprised": "FM_SURPRISED",
      "Calm": "FM_CALM"
    }
  },
  "factContracts": [
    {
      "factType": "RosterInvalidTotal",
      "producer": "Roster/Application Adapter",
      "description": "ActiveRosterValidator 결과 Total != 25를 Presentation fact로 변환",
      "payload": {
        "current": "int",
        "required": "int"
      }
    },
    {
      "factType": "RosterRoleCountInvalid",
      "producer": "Roster/Application Adapter",
      "description": "야수14/투수11 구성 불일치 결과",
      "payload": {
        "hitters": "int",
        "pitchers": "int"
      }
    },
    {
      "factType": "ForeignPlayerLimitExceeded",
      "producer": "Roster/Application Adapter",
      "description": "ActiveRoster 외국인 최대3 위반 결과",
      "payload": {
        "current": "int",
        "limit": "int"
      }
    },
    {
      "factType": "DuplicatePlayerPerson",
      "producer": "Roster/Application Adapter",
      "description": "동일 PlayerPersonId 중복 등록 결과",
      "payload": {
        "playerName": "string",
        "playerPersonId": "string"
      }
    },
    {
      "factType": "HitterOffPositionAssigned",
      "producer": "Lineup/Application Adapter",
      "description": "PositionAssignmentPenaltyResolver 결과 비주포지션 야수 배치",
      "payload": {
        "playerName": "string",
        "assignedPosition": "string",
        "naturalPosition": "string",
        "playerInstanceId": "string"
      }
    },
    {
      "factType": "HitterAssignedToDH",
      "producer": "Lineup/Application Adapter",
      "description": "DH 배치 사실. OffPosition 수비 페널티 없음",
      "payload": {
        "playerName": "string",
        "playerInstanceId": "string"
      }
    },
    {
      "factType": "PitcherRoleMismatchAssigned",
      "producer": "Pitching/Application Adapter",
      "description": "본래 PitcherRole과 AssignedPitcherRole 불일치 결과",
      "payload": {
        "playerName": "string",
        "naturalRole": "string",
        "assignedRole": "string",
        "playerInstanceId": "string"
      }
    },
    {
      "factType": "ScoutPityReady",
      "producer": "Manager Economy/Application Adapter",
      "description": "PityGauge == 100 사실",
      "payload": {
        "pityCycleId": "string"
      }
    },
    {
      "factType": "ScoutPityFilterNoCandidate",
      "producer": "Scout/Application Adapter",
      "description": "선택 필터에 Cost7+ 후보가 없음",
      "payload": {
        "filterName": "string",
        "filterKey": "string"
      }
    },
    {
      "factType": "TeamColorUnlocked",
      "producer": "TeamColor/Application Adapter",
      "description": "TeamColorResolver.Resolve 결과 신규 후보 활성화",
      "payload": {
        "teamColorName": "string",
        "teamColorId": "string"
      }
    },
    {
      "factType": "TacticTriggered",
      "producer": "Match/Application Adapter",
      "description": "TacticCardResolver 발동 결과를 전달",
      "payload": {
        "cardName": "string",
        "activationId": "string"
      }
    },
    {
      "factType": "CareerStartingLineupSelected",
      "producer": "Career/Application Adapter",
      "description": "감독 AI가 확정한 선발 라인업 결과",
      "payload": {
        "battingOrder": "int",
        "position": "string"
      }
    },
    {
      "factType": "CareerNotStarting",
      "producer": "Career/Application Adapter",
      "description": "감독 AI가 선발 제외한 결과와 설명용 요약",
      "payload": {
        "reasonSummary": "string"
      }
    },
    {
      "factType": "LeaguePromotion",
      "producer": "League/Application Adapter",
      "description": "승강 Resolver 확정 결과",
      "payload": {
        "fromGrade": "string",
        "toGrade": "string"
      }
    },
    {
      "factType": "AllStarSelected",
      "producer": "Award/Application Adapter",
      "description": "WorldAwardRecord AllStar 확정",
      "payload": {
        "playerName": "string",
        "awardRecordId": "string"
      }
    },
    {
      "factType": "GoldenGloveSelected",
      "producer": "Award/Application Adapter",
      "description": "WorldAwardRecord GoldenGlove 확정",
      "payload": {
        "playerName": "string",
        "position": "string",
        "awardRecordId": "string"
      }
    },
    {
      "factType": "RegularSeasonMvpSelected",
      "producer": "Award/Application Adapter",
      "description": "Statistics 기반 Regular MVP 확정",
      "payload": {
        "playerName": "string",
        "awardRecordId": "string"
      }
    }
  ],
  "cueDefinitions": [
    {
      "cueId": "HOME_DAILY_BRIEFING",
      "factType": "DailyBriefingReady",
      "modeScope": "Common",
      "priority": "Normal",
      "presentationType": "Briefing",
      "expressionKey": "Analysis",
      "requiredPayload": [
        "gameCount",
        "primaryHeadline"
      ],
      "repeatPolicy": {
        "dedupeKeyTemplate": "HOME_DAILY_BRIEFING:{dayId}",
        "cooldownScope": "Day",
        "maxDisplaysPerScope": 1
      },
      "cta": {
        "action": "OpenDailyBriefing",
        "label": "브리핑 보기"
      },
      "requiresAcknowledgement": false,
      "variations": [
        {
          "variationId": "HOME_DAILY_BRIEFING_A",
          "weight": 40,
          "tone": "Calm",
          "text": "오늘 확인할 내용이 정리됐습니다.\n예정된 경기는 {gameCount}경기이고, 가장 중요한 소식은 ‘{primaryHeadline}’입니다."
        },
        {
          "variationId": "HOME_DAILY_BRIEFING_B",
          "weight": 35,
          "tone": "Friendly",
          "text": "오늘 일정부터 살펴볼까요?\n경기는 {gameCount}경기 예정되어 있고, 먼저 확인할 소식은 ‘{primaryHeadline}’입니다."
        },
        {
          "variationId": "HOME_DAILY_BRIEFING_C",
          "weight": 25,
          "tone": "Analysis",
          "text": "오늘 운영의 우선순위를 정리했습니다.\n{gameCount}경기 일정과 ‘{primaryHeadline}’부터 확인하시면 됩니다."
        }
      ],
      "tags": [
        "Home",
        "Daily"
      ]
    },
    {
      "cueId": "HOME_MATCH_DAY",
      "factType": "MatchDayStarted",
      "modeScope": "Common",
      "priority": "Normal",
      "presentationType": "ContextBubble",
      "expressionKey": "Welcome",
      "requiredPayload": [
        "gameCount"
      ],
      "repeatPolicy": {
        "dedupeKeyTemplate": "HOME_MATCH_DAY:{dayId}",
        "cooldownScope": "Day",
        "maxDisplaysPerScope": 1
      },
      "cta": {
        "action": "OpenSchedule",